{
  "version": "1",
  "verdict": "request_changes",
  "ref": "4f2c1a9e8b3d7c5a1f0e2d4b6a8c9e1f3a5b7c9d",
  "summary": "The retry loop is sound, but the context deadline is not propagated to the downstream call, so a cancelled request keeps retrying.",
  "comments": [
    {
      "id": "dropped-context-1",
      "priority": 9,
      "category": "correctness",
      "body": "The retry loop calls c.do(context.Background(), req) rather than passing the caller's ctx, so a cancelled request keeps retrying for the full backoff schedule.",
      "anchors": [
        {
          "file": "internal/fetch/client.go",
          "line": 88,
          "end_line": 94
        }
      ],
      "suggestions": []
    },
    {
      "id": "untested-cancellation-1",
      "priority": 5,
      "category": "testing",
      "body": "No test covers cancellation mid-retry, which is why the dropped context above went unnoticed at review time and would regress silently.",
      "anchors": [
        {
          "file": "internal/fetch/client_test.go"
        }
      ],
      "suggestions": [
        {
          "summary": "Add a case that cancels the context after the first attempt",
          "effort": "small",
          "scope": "file",
          "pros": [
            "Pins the behaviour the fix introduces"
          ],
          "cons": [
            "Needs a controllable clock"
          ]
        }
      ]
    },
    {
      "id": "stale-doc-comment-1",
      "priority": 3,
      "category": "documentation",
      "body": "The godoc on Fetch still describes the old two-argument signature, which has not been correct since the context parameter was added.",
      "anchors": [
        {
          "file": "internal/fetch/doc.go",
          "line": 12
        }
      ],
      "suggestions": [
        {
          "summary": "Update the godoc to match the current signature",
          "effort": "trivial",
          "scope": "line",
          "pros": [
            "Removes a claim that is now false"
          ],
          "cons": [
            "None; the comment is already wrong"
          ]
        }
      ]
    }
  ]
}
