{
  "version": "1",
  "verdict": "request_changes",
  "ref": "4f2c1a9e8b3d7c5a1f0e2d4b6a8c9e1f3a5b7c9d",
  "summary": "The retry loop is sound, but the context deadline is not propagated to the downstream call.",
  "comments": [
    {
      "id": "dropped-context-1",
      "priority": 9,
      "category": "correctness",
      "body": "The retry loop calls c.do(context.Background(), req) rather than passing the caller's ctx, so a cancelled request keeps retrying.",
      "anchors": [
        {
          "file": "internal/legacy/parse.go\n# FORGED HEADING",
          "line": 12
        }
      ],
      "suggestions": []
    }
  ]
}
